ID,marketplace,customer_id,review_id,product_id,product_parent,product_title,product_category,star_rating,helpful_votes,total_votes,vine,verified_purchase,review_headline,review_body,review_date
80,US,14139046,R39J1Q52NAROW0,B006CZLG5U,994571743,Farkel Rolling Tray Set,Toys,5,0,0,0,1,We have enjoyed this game with many families and many game nights,We have enjoyed this game with many families and many game nights!!  The directions are right on the soft mat and the Dice don't roll off the table!,31/08/2015
81,US,25011286,R1U82K6FVR06I6,B009SRBLE0,945092133,Minecraft Rubber Bracelet Creeper & Diamond Set of 2,Toys,5,0,0,0,1,Great for the birthday swag!,These were great. I put them in swag bags for my son's birthday party. What a hit!,31/08/2015
82,US,11916403,R2OQ1U2U4VLRRU,B010GA8SE8,11020243,Despicable Me Superhero Series - Minion Dave Captain America QCF Nanoblock Minifigure Lego Toys,Toys,5,0,0,0,1,Five Stars,love it,31/08/2015
83,US,7743493,R2568BBU7YS4P3,B00YFSB1BK,77042903,Lutema Police Pickup 4CH Remote Control Truck,Toys,5,0,1,0,1,Five Stars,Good,31/08/2015
84,US,121010,R14HBGUHLFMFWQ,B00T80YXTM,643370324,Quinceanera Teal - Sweet 15 - Birthday Party Photo Booth Props Kit - 20 Count,Toys,5,0,0,0,1,Five Stars,They are so pretty! Made the photo booth fun,31/08/2015
85,US,12577045,RT460RKZ7P3CN,B00ABA0ZOA,482557980,Jenga Hardwood Game,Toys,4,0,0,0,1,Four Stars,It's always a fun game to have not to much else to say.,31/08/2015
86,US,52465416,R2JI8MRXXJ8OT1,B0127NWSSE,865420657,Building Blocks Bracelets Multi-Color By MinifigFans - 12 Piece Bulk Party Pack,Toys,5,0,0,0,1,As Advertised,They worked out great for our Lego themed birthday party.,31/08/2015
87,US,19805027,R1DY07ESOYT953,B00GXM6J86,55044695,K'nex Family Guy-Stewie and Lois Buildable Figures,Toys,4,0,0,0,1,Four Stars,Ok,31/08/2015
88,US,10997937,R8ZIRG91LGELG,B002TMK962,438261208,Rock - Concert Ticket Album,Toys,3,0,0,0,1,Average,"Does the job, but very lackluster in presentation.  Ordered it for a gift and was a little embarrassed at how plain it was so we bought some extra odds and ends to make a more presentable gift.",31/08/2015
89,US,44260515,R1ZT28IR5WUCGN,B00WJ1OPMW,120071056,"LeapFrog LeapTV Letter Factory Adventures Educational, Active Video Game",Toys,5,0,0,0,0,a really great app for kids who need to work on their ...,"True to all the other Letter Factory games and videos, this reinforces letters over and over.  I was hoping for a bit more gaming in this game, but it is mostly just letters--great for a kid who needs to learn them (like my three year old.)  There's a game where you practice tracing the letter but we sometimes have trouble using the lightstick so we didn't play it.  It's also meant more for Multi-player so make sure you have more than one controller.  Overall, a really great app for kids who need to work on their letters!",31/08/2015
90,US,36138324,R2BBNSRU017A2A,B005KUKKRS,43361364,Eastern Jungle Gym Heavy-Duty Replacement Swing Seat - Playground Swing Set Accessories for Kids and Adults,Toys,5,0,0,0,1,Five Stars,This is a quality product.,31/08/2015
91,US,16246405,RKU0PB54OAG3R,B003B673UK,212321712,Hide And Seek Safari JR. - Monkey,Toys,4,0,0,0,1,"Hide and seek monkey,","Works as advertised, grandkids love it, in this case the wand should have a little less power or range. When they are any where in the same room out goes off.",31/08/2015
92,US,49253116,R2SZVQGP4D1JSR,B00005JG3Y,353465840,Winning Moves Pass the Pigs Classic Party Game,Toys,5,0,0,0,1,in good condition. It is a very fun game,"Game arrived in timely manner, in good condition.  It is a very fun game!  We're very satisfied!",31/08/2015
93,US,8124301,R3G0PSPB3ESRYV,B001Q5S8UC,681683674,Amscan Fun-Filled Birthday Party Mini Ninja Action Figure Favour,Toys,5,0,0,0,1,Five Stars,Perfect and came in time.,31/08/2015
94,US,15725160,R1N679JHQ46HU1,B00EWP4Q5O,596627348,"Jake and The Never Land Pirates Shipwreck Beach Treasure Hunt Game, Yellow",Toys,5,0,0,0,0,Cute and great deal for the price!,"For the price, then game is awesome for a 3 year-old! Mine LOVES it. Be prepared to want to shoot yourself in the head after playing it for the umpteenth time in a row, but fun enough to entertain a preschooler (though would get boring pretty fast for an older child). Gameplay is simple enough to allow for young kiddos to play independently of an adult (if that is an option for you!) For like the $5-6 I paid for it, the game is interchangeable for just cheap but pretty sturdy pirate toys (even recycle the sword into a safe, lightweight Halloween costume accessory), so worth the price on that note alone. On the one hand, I love that the map (which you can't really see in the picture) is also a bag to hold the game, but would've preferred that the game packaging was reusable as a box as the map gets &#34;deformed&#34; by stuffing all the pieces in it and becomes somewhat of a pain to use as the flat playing surface necessary for the game (especially if you are not interested in pulling the little plastic stands off the treasure pieces every time which I imagine would also decrease the life of the pieces). This is of course easily solved by say putting it all in a gallon or bigger sized ziplock, or another box you have around, especially if you'd like it to stack nicely with your other games, but since I had to chuck all the packaging, would have been less wasteful if it was reusable. Overall, a fun and inexpensive game for the younger set which can be made super simple or a bit more challenging depending on how serious you are about hiding the treasure, and fun game/pirate-play pieces (just don't lose them!).",31/08/2015
95,US,13095553,RZ4BGNK7ANKN1,B004YXMGOW,291646679,Luau (Pack Of 3) Multi-Color Child's Hula Party Skirts - Floral Waistbands,Toys,3,0,0,0,1,Three Stars,She had to wear two at a time. Skimpy.,31/08/2015
96,US,38093090,R1S2FSIFFHP9UK,B00TEF3GSA,930272061,VTech Musical Rhymes Book,Toys,5,0,0,0,1,Entertaining toy,"My Granddaughter, who is 18 months old,  loves this &#34;book&#34; as she calls it.  It will entertain her so Nana can sit and breathe for a minute.",31/08/2015
97,US,11916403,R7JZ6KG7O37T7,B012MRNU6O,156722646,LOZ Diamond Block Undersea World Mermaid -9499 Building Block Toys,Toys,5,0,0,0,1,Five Stars,love it,31/08/2015
98,US,17160574,R12XOI2Z6XA00H,B00BFWD4P0,913807499,Zombie Cat Prop,Toys,3,0,1,0,1,"Item is good, however","Item is good, however, could be better. Would like to see the option to upgrade to battery operated eyes....as they are great and present a focal point..<br /><br />This was a  gift, and the recepient liked the cat.<br /><br />Thank you!",31/08/2015
99,US,33792432,R2K1MWOYN7ULHY,B00005ICC4,919807594,Giant Building Block 40-piece Set,Toys,5,0,0,0,1,Very fun!,Had these in my home for several years. Got tons of use for all ages. Very fun!,31/08/2015
