ID,marketplace,customer_id,review_id,product_id,product_parent,product_title,product_category,star_rating,helpful_votes,total_votes,vine,verified_purchase,review_headline,review_body,review_date
0,US,18778586,RDIJS7QYB6XNR,B00EDBY7X8,122952789,Monopoly Junior Board Game,Toys,5,0,0,0,1,Five Stars,Excellent!!!,31/08/2015
1,US,24769659,R36ED1U38IELG8,B00D7JFOPC,952062646,56 Pieces of Wooden Train Track Compatible with All Major Train Brands,Toys,5,0,0,0,1,Good quality track at excellent price,"Great quality wooden track (better than some others we have tried). Perfect match to the various vintages of Thomas track that we already have. There is enough track here to have fun and get creative incorporating your key pieces with track splits, loops and bends.",31/08/2015
2,US,44331596,R1UE3RPRGCOLD,B002LHA74O,818126353,Super Jumbo Playing Cards by S&S Worldwide,Toys,2,1,1,0,1,Two Stars,Cards are not as big as pictured.,31/08/2015
3,US,23310293,R298788GS6I901,B00ARPLCGY,261944918,Barbie Doll and Fashions Barbie Gift Set,Toys,5,0,0,0,1,my daughter loved it and i liked the price and it came ...,my daughter loved it and i liked the price and it came to me rather than shopping with a ton of people around me. Amazon is the Best way to shop!,31/08/2015
4,US,38745832,RNX4EXOBBPN5,B00UZOPOFW,717410439,Emazing Lights eLite Flow Glow Sticks - Spinning Light LED Toy,Toys,1,1,1,0,1,DONT BUY THESE!,Do not buy these! They break very fast I spun then for 15 minutes and the end flew off don't waste your money. They are made from cheap plastic and have cracks in them. Buy the poi balls they work a lot better if you only have limited funds.,31/08/2015
5,US,13394189,R3BPETL222LMIM,B009B7F6CA,873028700,Melissa & Doug Water Wow Coloring Book - Vehicles,Toys,5,0,0,0,1,Five Stars,Great item. Pictures pop thru and add detail as &#34;painted.&#34;  Pictures dry and it can be repainted.,31/08/2015
6,US,2749569,R3SORMPJZO3F2J,B0101EHRSM,723424342,Big Bang Cosmic Pegasus (Pegasis) Metal 4D High Performance Generic Battling Top BB-105,Toys,3,2,2,0,1,Three Stars,"To keep together, had to use crazy  glue.",31/08/2015
7,US,41137196,R2RDOJQ0WBZCF6,B00407S11Y,383363775,Fun Express Insect Finger Puppets 12ct Toy,Toys,5,0,0,0,1,Five Stars,I was pleased with the product.,31/08/2015
8,US,433677,R2B8VBEPB4YEZ7,B00FGPU7U2,780517568,Fisher-Price Octonauts Shellington's On-The-Go Pod Toy,Toys,5,0,0,0,1,Five Stars,Children like it,31/08/2015
9,US,1297934,R1CB783I7B0U52,B0013OY0S0,269360126,Claw Climber Goliath/ Disney's Gargoyles,Toys,1,0,1,0,1,Shame on the seller !!!,Showed up not how it's shown . Was someone's old toy. with paint on it.,31/08/2015
10,US,52006292,R2D90RQQ3V8LH,B00519PJTW,493486387,100 Foot Multicolor Pennant Banner,Toys,5,0,0,0,1,Five Stars,"Really liked these. They were a little larger than I thought, but still fun.",31/08/2015
11,US,32071052,R1Y4ZOUGFMJ327,B001TCY2DO,459122467,Pig Jumbo Foil Balloon,Toys,5,0,0,0,1,Nice huge balloon,"Nice huge balloon! Had my local grocery store fill it up for a very small fee, it was totally worth it!",31/08/2015
12,US,7360347,R2BUV9QJI2A00X,B00DOQCWF8,226984155,Minecraft Animal Toy (6-Pack),Toys,5,0,1,0,1,Five Stars,Great deal,31/08/2015
13,US,11613707,RSUHRJFJIRB3Z,B004C04I4I,375659886,Disney Baby: Eeyore Large Plush,Toys,4,0,0,0,1,Four Stars,As Advertised,31/08/2015
14,US,13545982,R1T96CG98BBA15,B00NWGEKBY,933734136,Team Losi 8IGHT-E RTR AVC Electric 4WD Buggy Vehicle (1/8 Scale),Toys,3,2,4,0,1,... servo so expect to spend 150 more on a good servo immediately be the stock one breaks right,Comes w a 15$ servo so expect to spend 150 more on a good servo immediately be the stock one breaks right away,31/08/2015
15,US,43880421,R2ATXF4QQ30YW,B00000JS5S,341842639,Hot Wheels 48- Car storage Case With Easy Grip Carrying Case,Toys,5,0,0,0,1,Five Stars,awesome ! Thanks!,31/08/2015
16,US,1662075,R1YS3DS218NNMD,B00XPWXYDK,210135375,"ZuZo 2.4GHz 4 CH 6 Axis Gyro RC Quadcopter Drone with Camera & LED Lights, 38 x 38 x 7cm",Toys,5,4,4,0,0,The closest relevance I have to items like these is while in the army I was trained ...,I got this item for me and my son to play around with. The closest relevance I have to items like these is while in the army I was trained in the camera rc bots. This thing is awesome we tested the range and got somewhere close to 50 yards without an issue. Getting the controls is a bit tricky at first but after about twenty minutes you get the feel for it. The drone comes just about fly ready you just have to sync the controller. I am definitely a fan of the drones now. Only concern I have is maybe a little more silent but other than that great buy.<br /><br />*Disclaimer I received this product at a discount for my unbiased review.,31/08/2015
17,US,18461411,R2SDXLTLF92O0H,B00VPXX92W,705054378,Teenage Mutant Ninja Turtles T-Machines Tiger Claw in Safari Truck Diecast Vehicle,Toys,5,0,0,0,1,Five Stars,It was a birthday present for my grandson and he LOVES IT!!,31/08/2015
18,US,27225859,R4R337CCDWLNG,B00YRA3H4U,223420727,Franklin Sports MLB Fold Away Batting Tee,Toys,3,0,1,1,0,Got wrong product in the shipment,"Got a wrong product from Amazon Vine and unable to provide a good review. We received a pair of cute girls gloves and a baseball ball instead, while we were expecting a boys batting tee. The gloves are cute, however made for at least 6+ yrs or above...more likely 8-9 yrs old girls.<br /><br />Can't provide a fair review as we were not able to use the product.",31/08/2015
19,US,20494593,R32Z6UA4S5Q630,B009T8BSQY,787701676,Alien Frontiers: Factions,Toys,1,0,0,0,1,Overpriced.,You need expansion packs 3-5 if you want access to the player aids for the Factions expansion. The base game of Alien Frontiers just plays so much smoother than adding Factions with the expansion packs. All this will do is pigeonhole you into a certain path to victory.,31/08/2015
20,US,6762003,R1H1HOVB44808I,B00PXWS1CY,996611871,Holy Stone F180C Mini RC Quadcopter Drone with Camera 2.4GHz 6-Axis Gyro Bonus Battery and 8 Blades,Toys,5,1,1,0,0,Five Stars,Awesome customer service and a cool little drone! Especially for the price!,31/08/2015
21,US,25402244,R4UVQIRZ5T1FM,1591749352,741582499,Klutz Sticker Design Studio: Create Your Own Custom Stickers Craft Kit,Toys,4,1,2,0,1,Great product for little girls!,"I got these for my daughters for plane trip. I liked that the zipper pouch was attached for markers.  However, that pouch fell off.  But the girls have loved coloring their own stickers. Would def buy this again.",31/08/2015
22,US,32910511,R226K8IJLRPTIR,B00V5DM3RE,587799706,Yoga Joes - Green Army Men Toys,Toys,5,0,1,0,1,Creative and fun!,"My girlfriend and I are both into yoga and I gave her a set of the Yoga Joes for her new home yoga room. When she saw them, she was impressed that I had found little green army men like her brother used to play with. Then she realized they were doing yoga and she almost exploded with delight. You should have seen the look on her face. Needless to say, the gift was a huge hit. They are absolutely brilliant!",31/08/2015
23,US,18206299,R3031Q42BKAN7J,B00UMSVHD4,135383196,Lalaloopsy Girls Basic Doll- Prairie Dusty Trails,Toys,4,1,1,0,0,i like it but i absoloutely hate that some dolls don't ...,i like it but i absoloutely hate that some dolls don't have pets like this one so I'm not stoked and i really would have liked to see her pet,31/08/2015
24,US,26599182,R44NP0QG6E98W,B00JLKI69W,375626298,WOW Toys Town Advent Calendar,Toys,3,1,1,0,1,We love how well they are made,"We have MANY Wow toys in our home.  We love how well they are made.  The advent calendar is an exception.  The plastic is thinner than our other wow toys and the barn animals won't even stand up on their own due to the head weighing more than the body and uneven base of the toy.  Very disappointing when we love the concept.  The story to read along with everyday is great.  I would have preferred quality (and would have paid more for it) instead of a cheap &#34;knock-off&#34; of the rest of their toy line.  It is very obvious by the weight of the toys sloppy paint jobs which items in our &#34;Wow Toys&#34; bin are part advent calendar vs. the rest of the toys we have.  Also there is a lot of overlap between the wow town advent calendar & winter wonderland calendar, which makes me want to look for alternatives for this year's advent calendar options.",31/08/2015
25,US,128540,R24VKWVWUMV3M3,B004S8F7QM,829220659,Cards Against Humanity,Toys,5,0,0,0,1,Five Stars,Tons of fun,31/08/2015
26,US,125518,R2MW3TEBPWKENS,B00MZ6BR3Q,145562057,Monster High Haunted Student Spirits Porter Geiss Doll,Toys,5,0,0,0,1,Five Stars,Love it great add to collecton,31/08/2015
27,US,15048896,R3N01IESYEYW01,B001CTOC8O,278247652,Star Wars Clone Wars Clone Trooper Child's Deluxe Captain Rex Costume,Toys,5,0,1,0,1,Five Stars,Exactly as described.  Fits my 7-yr old well!,31/08/2015
28,US,12191231,RKLAK7EPEG5S6,B00BMKL5WY,906199996,LEGO Creative Tower Building Kit XXL 1600 Pieces 10664,Toys,5,1,2,0,1,The children LOVED them and best part was that it helped the ...,Purchased these Lego's to help aid me with teaching my Sunday School class. The children LOVED them and best part was that it helped the children remember past lessons. The true Lego brand seem to work/snap together/fit together better than the generic brands. (Plus I had some Lego snobs in my class that only would use the real Lego brand and shunned the generic brand). Only wish Lego's were a little cheaper but you get what you pay for and I would recommend for quality to purchase this set.,31/08/2015
29,US,18409006,R1HOJ5GOA2JWM0,B00L71H0F4,692305292,Barkology Princess the Poodle Hand Puppet,Toys,2,1,1,0,1,My little dog can bite my hand right through the puupet.,"IT's OK, but not as good as the old Bite Meez puppets. This puppet is very thin. My little yorkie often bites my hands right through the stuffing. It not durable enough to really play with.",31/08/2015
30,US,42523709,RO5VL1EAPX6O3,B004CLZRM4,59085350,Intex Mesh Lounge (Colors May Vary),Toys,1,0,0,0,1,Save your money...don't buy!,"This was to be a gift for my husband for our new pool. Did not receive the color I ordered but most of all after only one month of use (not continuously) the mesh pulled away from the material and the inflatable side. Completely shredded and no longer of use. It was stored properly and was not kept outside or in the pool. Poorly made, better off going to W**-M*** and getting something on clearance.",31/08/2015
31,US,45601416,R3OSJU70OIBWVE,B000PEOMC8,895316207,"Intex River Run I Sport Lounge, Inflatable Water Float, 53 in Diameter",Toys,5,0,0,0,1,but I've bought one in the past and loved,"Ended up sending this guy back because I didnt need it, but I've bought one in the past and loved it",31/08/2015
32,US,47546726,R3NFZZCJSROBT4,B008W1BPWQ,397107238,Peppa Pig 7 Wood Puzzles In Wooden Storage Box (styles will vary),Toys,3,0,0,0,1,Three Stars,"The product is good, but the box was broken.",31/08/2015
33,US,21448082,R47XBGQFP039N,B00FZX71BI,480992295,Paraboard - Parallel Charging Board for Lipos with EC5 Connectors,Toys,5,0,0,0,1,CAN SAVE TME IF YOU UNDESTAND HOW IT WORKS .,"Works well ,quality product but this style of board will charge multiple batteries at the same time SAFELY  ( IF )  ALL BATTERIES ARE OF THE SAME CELL COUNT , THE SAME BATTERY COMPOSITION ( LIPO, NIMH-etc ) AND THEY MUST HAVE INDIVIDUAL CELL VOLTAGES THAT ARE VERY CLOSE AND EQUAL TO EACH BATTERY CONNECTED AT THE SAME TIME . When board is connected to most if not all chargers it can only read total and individual cell voltage of ONE OF THE BATTERIES AND MAY OVER OR UNDER CHARGE THE OTHERS TO SOME DEGREE , TOTAL RATE OF CHARGE IS DIVIDED EQUALLY BETWEEN BATTERIES CONNECTED AT THE SAME TIME . Close monitoring is a must  when using like all high discharge batteies . I  have only personally expeienced one lipo battery meltdown and it is a very  SHORT IF NOT  NON EXISTANT WINDOW OF OPPERUNITY TO PREVENT OR MINIMISE THE COLATTERAL DAMAGE ONCE THE PROCESS STARTS . Read and understand all charging and battery instructions .",31/08/2015
34,US,12612039,R1JS8G26X4RM2G,B00D4NJSJE,408940178,"The Game of Life Money and Asset Board Game, Fame Edition",Toys,5,0,1,0,1,Five Stars,Great gift!,31/08/2015
35,US,44928701,R1ORWPFQ9EDYA0,B000HZZT7W,967346376,LCR Dice Game (Red Chips),Toys,5,0,0,0,1,Five Stars,We play this game quite a bit with friends.,31/08/2015
36,US,43173394,R1YIX4SO32U0GT,B002G54DAA,57447684,BCW - Deluxe Currency Slab - Regular Bill - Dollar / Currency Collecting Supplies,Toys,5,0,1,0,1,BCW - Deluxe Currency Slab,Fits my $20 bill perfectly.,31/08/2015
37,US,11210951,R1W3QQZ8JKECCI,B003JT0L4Y,876626440,Ocean Life Stamps Birthday Party Supplies Loot Bag Accessories 24 Pieces per Unit,Toys,5,0,0,0,1,Fun for birthday party favor,I ordered these for my 3 year old son's birthday party as party favors. They were a huge hit & the perfect fit for a 3 year old!,31/08/2015
38,US,12918717,RZX17JIYIPAR,B00KQUNNZ8,644368246,"New Age Scare Halloween Party Pumpkin and Bat Hanging Round Lantern Decoration, Paper, 9"" Pack of 3",Toys,5,0,0,0,0,Love the prints!,"These paper lanterns are adorable! The colors are bright, the patterns are fun & trendy & they're a good size! They came well packaged & are easy to assemble, they're also really easy to take apart & flatten back down! We'll get to use them for a few Halloweens I'm sure! They even came with the string needed to hang! I'm glad I grabbed them, they're really cute, my kids are excited to add to the Halloween decor & are already asking to hang them!<br />I received this item at a discount for my unbiased review.",31/08/2015
39,US,47781982,RIDVQ4P3WJR42,B00WTGGGRO,162262449,Pokemon - Double Dragon Energy (97/108) - XY Roaring Skies,Toys,5,1,1,0,1,Five Stars,My Grandson loves these cards.  Thank you,31/08/2015
40,US,34874898,R1WQ3ME3JAG2O1,B00WAKEQLW,824555589,Whiffer Sniffers Mystery Pack 1 Scented Backpack Clip,Toys,1,0,6,0,1,One Star,Received a pineapple rather than the advertised s'more,31/08/2015
41,US,20962528,RNTPOUDQIICBF,B00M5AT30G,548190970,AmiGami Fox and Owl Figure 2-Pack,Toys,4,0,0,0,1,Four Stars,Christmas gift for 6yr,31/08/2015
42,US,47781982,R3AHZWWOL0IAV0,B00GNDY40U,438056479,Pokemon - Gyarados (31/113) - Legendary Treasures,Toys,5,0,0,0,1,Five Stars,My Grandson loves these cards.  Thank you,31/08/2015
43,US,13328687,R3PDXKS9O2Z20B,B00WJ1OPMW,120071056,"LeapFrog LeapTV Letter Factory Adventures Educational, Active Video Game",Toys,5,0,0,0,0,they LOVE this game,"Even though both of my kids are at the top of this age recommendation level, they LOVE this game!  I love how it caters to the kinesthetic learner by asking them to move their bodies into the shape of the letters.  It even takes teamwork as sometimes two people are required to finish the letter.  My kids know all of their letter sounds and shapes, but this didn't stop them from playing the game over and over.",31/08/2015
44,US,16245463,R23URALWA7IHWL,B00IGXV9UI,765869385,Disney Planes: Fire & Rescue Scoop & Spray Firefighter Dusty,Toys,5,0,0,0,1,Five Stars,My 5 year old son loves this.,31/08/2015
45,US,11916403,R36L8VKT9ZSUY6,B00JVY9J1M,771795950,Winston Zeddmore & Ecto-1: Funko POP! Rides x Ghostbusters Vinyl Figure,Toys,5,0,0,0,1,Five Stars,love it,31/08/2015
46,US,5543658,R23JRQR6VMY4TV,B008AL15M8,211944547,Yu-Gi-Oh! - Solemn Judgment (GLD5-EN045) - Gold Series: Haunted Mine - Limited Edition - Ghost/Gold Hybrid Rare,Toys,5,0,0,0,1,Absolutely one of the best traps in the game,Absolutely one of the best traps in the game. It is never a dead and always live since you can always pay half your lifepoints for its cost. It's main power is that it can stop any card. Hopefully this card comes off the Forbidden/Limited list soon.,31/08/2015
47,US,41168357,R3T73PQZZ9F6GT,B00CAEEDC0,72805974,Seat Pets Car Seat Toy,Toys,5,0,0,0,1,Five Stars,really soft and cute,31/08/2015
48,US,32866903,R300I65NW30Y19,B000TFLAZA,149264874,Baby Einstein Octoplush,Toys,5,0,0,0,1,Five Stars,baby loved it - so attractive and very nice,31/08/2015
49,US,12994636,R3MDVG6RXZ0KC4,B003C1MW4Q,532597434,Mr. Potato Head Toy Story 3 Classic Mr. Potato Head,Toys,5,0,0,0,1,Five Stars,Everyone loves this old classic toys,31/08/2015
50,US,23413911,R4SB75QT541TT,B00DYY6ZVM,886691682,"Ugly Dolls Hello Kitty l, Ice Bat",Toys,4,0,0,0,1,Ugly but loved,"My daughter loves this little thing.  One part Hello Kitty, one part bat, you can't go wrong.",31/08/2015
51,US,42872794,R1AHKUFBO1S7V3,B00OV26CUK,626655645,aBaby Mackenzie Personalized Pastel Name Puzzle,Toys,5,0,0,0,1,Five Stars,Much bigger than expected. Wish they had our other grandchildren's names.,31/08/2015
52,US,51393644,R2YLG0UT0NQ25C,B00GBSWNU0,842531328,"Magic The Gathering Planeswalker Flip Box, Grey",Toys,5,0,0,0,1,Five Stars,As advertised,31/08/2015
53,US,25893557,R1ML50QVMAEHIA,B013O46TM6,733506736,ISLANDIA Wooden Resource Tokens Set for Both 3-4 and 5-6 Player Games (Compatible with Settlers) by Artificially Natural,Toys,5,6,6,0,1,Catan is my husbands favorite game. We play all the time,"Catan is my husbands favorite game.  We play all the time.  Due to many of our resource cards being damaged or missing, I hopped onto Amazon to look for a replacement deck.  While searching, I came across these tokens.  Who knew?!?!  (I was not aware a product like this existed.)  On a whim, I bought a pack.... and I'm soooo glad I did!  Everyone loved playing with the lil' tokens.  Call me crazy... but I think the game is just more fun when you are using a miniature sheep for a sheep, a miniature wood for a wood, etc... instead of plain ole cards.  It was easy.  We each kept our pieces in a small non-see-through cup during play (you can also play with your resources visible to all).  Not to mention... they were just a fraction of the price of the replacement deck I was going to buy online!  We are very happy with our purchase.  :)",31/08/2015
54,US,26408771,R3AF8I3RA6OBXV,B00P4CGUSA,722328086,Shopkins Season 2 (5-Pack) (Styles Will Vary),Toys,5,0,0,0,1,Five Stars,"grand kids love them, came on time",31/08/2015
55,US,12994636,R25XLQ0A2OZZDJ,B0000696OX,297063495,Disguise Toy Story 2 Woody Costume,Toys,5,0,0,0,1,Five Stars,My grandson lives in this - soo cute,31/08/2015
56,US,50380861,R1YM5I20A1C04H,B00J4T75ME,418562639,Fisher-Price Octonauts Barnacles' Octopod Steering Deck,Toys,5,0,0,0,1,Five Stars,my boys love it,31/08/2015
57,US,30057578,R9W9VDJ261CJO,B0046EYVVU,340440599,Forum Novelties 59404 Gepetto Gray Moustache and Wig,Toys,4,0,0,0,1,"Darker than I thought, great for price!",For the price it's a great costume piece. A lot darker hair than I thought it would have in it.,31/08/2015
58,US,50603961,RUDU6BWZ4OH39,B001O5OLMS,293183305,Poolmaster Pirate Ship with Action Squirter,Toys,5,0,0,0,1,lots of fun,my soon to be 4 year old loves this thing...its holding up fine,31/08/2015
59,US,44984621,R1BBJDI7Z3AJW2,B00P0QMGWO,35688008,"Kotobukiya She-Hulk ""Marvel Comics"" - Bishoujo Statue - Kotobukiya Action Figure",Toys,5,1,1,0,1,Great Statue,Show those muscles.  Great statue.,31/08/2015
60,US,7386517,R8SCUAIH17RS6,B007JVU9TU,630735469,"GUND 12"" Red Shirt Curious George Plush Doll",Toys,5,1,1,0,1,My son LOVES it! He wouldn't put it down ...,My son LOVES it! He wouldn't put it down for the first couple weeks he had it. I'd say that this toy got my 3 year old's stamp of approval.,31/08/2015
61,US,34767682,R275YVJ9LD4BP9,B00DELMXCU,411990628,Frozen Elsa's Jewelry Set,Toys,5,0,0,0,1,Five Stars,daughter is very happy,31/08/2015
62,US,14901572,R3AIM61BUJQQ0B,B00WJ1O6P8,901464294,LeapFrog Scout's Build and Discover Tool Set Toy,Toys,4,0,1,0,0,Fun for tool-loving kids,This toy is sure to keep a kid who loves tools happy. It is a tool box that can be taken apart and put back together with the supplied tools. This toy is designed to teach shapes and colors with fun songs. It comes apart easily  and might be a bit frustrating for a younger toddler. A slightly older child will enjoy the challenge of taking apart and reassembling this toy.,31/08/2015
63,US,3366177,R2LR9ME8LO75JC,B00A78GZOA,21158346,AGPtEK Electric Portable Air Pump Balloon Pump,Toys,5,0,0,0,0,Air flow is really good..,"I bought this product for my kid]s birthday. It saved me lot of time in blowing all the balloons. Air flow is really good....there is touch on option too along with continuous nozzle..I used it for 1hr, it is working fine. Nice product....",31/08/2015
64,US,2321779,RCUSMINLNGF62,B012TROCLE,496781391,"Dante, Traveler of the Burning Abyss Super Rare Yu-Gi-Oh! Sexy Art Orica",Toys,5,2,3,0,1,"the artwork, amazing","amazing quality first of all, these cards are amazing proxies (but don't try to use em in &#34;official duels&#34; unless a judge is okay with it, if you have the real thing to show) and look amazing in your binder!",31/08/2015
65,US,22719359,R3G16P80BE17NB,B006ZO5Y9W,957391420,"Super Mario Brothers Fire Spitting Mario Themed 4"" Piggy Bank",Toys,5,0,0,0,1,Five Stars,Very good item. Quick delivery.,31/08/2015
66,US,1723365,R1LL4GHZL1ASXX,B00DPX62Z6,309560623,"Hedstrom Marvel Avengers Assemble Hopper Ball, Hop ball for kids",Toys,1,0,0,0,1,Very disappointing... Way too small.,This was much too small for an average size child to bounce on. It was the size of about a punching balloon. VERY DISAPPOINTING.,31/08/2015
67,US,49296159,R21IFNI7NHX7NX,B00JJL5C0E,523660658,Super Snap Speedway - 318 Pc Deluxe Set with 3 Motorized Cars,Toys,5,0,1,0,1,lots of fun my 4 year old directs me on what he ...,we have this track and another one that glows in the dark we combine them and make a giant track. lots of fun my 4 year old directs me on what he needs built and we have all kinds of fun with it,31/08/2015
68,US,39150715,R23LFYAIMTUMQK,B000RGRN7K,999312970,Slinky Brand Single Pop Toob,Toys,4,0,0,0,1,Four Stars,Loses it's ability to lengthen and shorten quickly as it gets little bends in the grooves.,31/08/2015
69,US,6235304,R1KVF9YJQWIXNF,B00IANTUPU,815622165,"Lego, Star Wars, Kashyyyk Troopers (75035) (Discontinued by manufacturer)",Toys,5,0,0,0,1,Five Stars,my grandson loves having good guys vs bad guys,31/08/2015
70,US,24638217,R2NZ654DZ2EO3U,B0006VR6GO,538530132,"Crayola Washable Crayons, Large, 8 Colors/box (52-3280)",Toys,5,0,0,0,1,Excellent Crayons,These are exactly what you would expect...large crayons.  Crayola is definitely the leader of the pack when it comes to crayons.  I purchased these for my 2 year old.  She is learning to write and draw and these fit in her hands much more comfortably than standard sized crayons.  With these being thicker they are harder for her to break too lol.  Bonus.  Overall these are great crayons and I highly recommend them.,31/08/2015
71,US,23268511,RY1L296RT1IU7,B00M5ATH3E,411561123,Disney Sparkle Princess Ariel Doll,Toys,5,0,0,0,1,Five Stars,very nice doll,31/08/2015
72,US,20940357,R1XNDG83B0DYNY,B008FD8ETS,29613450,Hungry Hungry Hippos,Toys,1,0,0,0,0,Don't waste your money. Not even close to the quality of the original Hungry Hippo from my childhood.,"Don't buy this. Cheaply made. Hippos get stuck. Cover for ball storage does not attach securely to the underside of game so every time they pick it up, the cover falls off and balls go everywhere. Can't believe this game actually passed QC standards. You would think it was a 99 cent game.",31/08/2015
73,US,127254,R30BROIV4HG62F,B00886M9ES,794618326,Snazaroo Face Paints - Turquoise 488 (30 ml),Toys,4,0,0,0,1,I very much liked this product,"I very much liked this product. However, when I opened it the packaging said '18ml' instead of '30ml'. Besides that, I really liked this paint.",31/08/2015
74,US,45576261,R1KZULMFF0V7XN,B00CANHZ4Y,193190825,Star Wars Darth Vader Voice Changer Helmet,Toys,5,0,0,0,1,Five Stars,Great toy hiogh quality voice changer is great,31/08/2015
75,US,47078434,R1A84GM7K4GZVW,B00A8VJB2O,527832220,"Nerf N-Sports Vortex Aero Howler Football, Orange and Grey",Toys,4,0,0,0,1,Throws really well and is well made. The nose ...,Throws really well and is well made. The nose is a bit hard and it hurt my 5 year old a few times when he didn't make the catch and got bumped in the face.,31/08/2015
76,US,30340908,R16HYMDSG70RLL,B00KNUE2UQ,536771335,McFarlane Toys NFL Series 35 Johnny Manziel Action Figure,Toys,5,1,1,0,1,Bent Packaging. Loses the value,"I think the figure itself looks great. But these are typically for a collector, and the package was bent and frayed at the edges. I expected a little more care with the packaging.",31/08/2015
77,US,24192333,R29NU5NNRYRCUU,B009DA973E,305738915,49mm Rock Bouncy Ball. 1 Dozen,Toys,1,0,6,0,1,Not as expected....,Not so good ;-(,31/08/2015
78,US,27367902,R16N0A77B9KDEJ,B00WJ1PPGM,999209932,LeapFrog LeapTV: Disney Frozen: Arendelle's Winter Festival Educational,Toys,4,0,0,1,0,Good for Ages 3 -5,"The grandchildren were here this past weekend so this game was fully tested and enjoyed. 2 boys - 1 Girl Ages 3 - 7. A nice variety of games with different skill levels. We learned very quickly that we needed an additional controller so that was purchased asap. The little ones loved showing off their counting talents but the older one grew bored with the play after his first turn. &#34;Too much like school Nana&#34;. I like that the 3 year olds will grow with the game. I would not recommend it for kids at the top of the age range though as it doesn't seem to hold their interest very long.<br /><br />A side note - After playing the game we had to break out the movie and watch for the umpteenth time but we are not complaining, we all love the movie.",31/08/2015
79,US,528911,R1HMJ6ZZTUF61I,B00RJJQED2,60267602,"Bandai Tamashii Nations Movie Realization Ashigaru Storm Trooper ""Star Wars"" Action Figure",Toys,5,1,1,0,1,Five Stars,I loved it and my boyfriend really loves it.,31/08/2015
