,day,date,month,year,product_name,category,review,rating,vote_score
86,Monday,31,8,2015,Paris Woman Perfume impression of Paris Hilton for Women,Beauty,five stars excelente,10,0
87,Monday,31,8,2015,Conair Folding Dryer,Beauty,five stars compact easy use traveling,10,0
88,Monday,31,8,2015,OPTP Original McKenzie Cervical Roll - (703) Pillow for spine and neck support during sleep,Beauty,dont really like often makes neck hurt worse dont really like often makes neck hurt worse maybe fat hard,2,0
89,Monday,31,8,2015,David Beckham Homme Cologne By David Beckham For Men,Beauty,great scent reasonable price son loves hard find shelves stores great scent reasonable price,10,0
90,Monday,31,8,2015,Unite Smoothing Shampoo & Condition 10oz 300ml Duo Set,Beauty,heathy lovely smelling frizz free hair hallelujah love thick great smelling shampoo conditioner hair highlighted regularly gets keratin treatments living humid south product keeps hair smooth healthy ps little goes long way,10,5
91,Monday,31,8,2015,Sweet Almond Oil for Skin Hair and Face - Large 16oz - WITH PUMP + FREE Recipe eBook! - All Natural Sensual Massage Oil - Use with Essential Oils and Aromatherapy as a Carrier and Base oil,Beauty,five stars nice oil enjoy brand,10,0
92,Monday,31,8,2015,#1 Blackhead & Blemish Remover Kit - Equinox Acne Treatment - 5 Professional Surgical Extractor Instruments - Easily Cure Pimples Blackheads Comedones Acne and Facial Impurities,Beauty,high quality tweezerman like impressed tools high quality 34tweezerman34 like impressed,6,0
93,Monday,31,8,2015,UltraSwim Chlorine Removal Shampoo 7 fl oz (207 ml),Beauty,5 star great productdoes jobreasonably priced good product good price product difficult find store shelves wife uses swimming pool important available get cholrine getting quantity makes life simple product excellent job recommend,10,1
94,Monday,31,8,2015,Hoyts Original Cologne 1868,Beauty,five stars great product,10,0
95,Monday,31,8,2015,Mens Durable Shave Soap Cup Shinning Stainless Steel Shaving Mug Bowl,Beauty,junk going use shaving junk worth four bucks,2,1
96,Monday,31,8,2015,Deva Curl Light Defining Gel 32 oz,Beauty,deva light defining gel shout lightly curled hair used every product imaginable hair need volume holding quality deva light good hair job well tested animals use deva products find fairly priced excellent curly hair nothing said amazon always time helpful people phone great service,10,0
97,Monday,31,8,2015,Crest Pro-Health Advanced Mouthwash with Extra Deep Clean,Beauty,like mouthwash like mouthwash great taste seems work feel like mouth cleaner taste pretty good slight taste sure describe first tasted little like bubble gum changes back mint burn real plus hate mouthwash burnsbr trust review part shopper army,10,0
98,Monday,31,8,2015,Ardell Brow Sculpting Gel - Clear 7.3ml/0.25oz,Beauty,five stars great product,10,0
99,Monday,31,8,2015,PURA DOR Organic Moroccan Argan Oil 100 Percent Pure Cold Pressed and USDA Organic Anti-Aging For Face Hair Skin and Nails 4 Fluid Ounce,Beauty,love use straight use dry aging skin care love use straight bottle also add serum make moisturizes conditions skin feels looks fabulous cant say enough price great,10,0
